{
  "schema": "hiliftaeroml-compact-profile-chunk-v2-candidate",
  "schema_version": "2.0",
  "format": "fluidsbench-hiliftaeroml-compact-profile-chunks-v2-candidate",
  "contract_id": "hiliftaeroml-compact-profile-predictions-v2-candidate",
  "contract_sha256": "b1fd29b2cb6c1c84c694ddffc5d85f6cd68fd175b79c3695a443aa78bf962c2f",
  "submission_id": "hiliftaeroml-geotransolver-ood-aoa-candidate-v1",
  "dataset_id": "hiliftaeroml",
  "split_id": "aoa",
  "case_set_id": "caseset-29693354ed8a",
  "cases": [
    {
      "case_id": "geo_LHC113_AoA_14",
      "artifact": {
        "format": "numpy-npz-v1",
        "file": "artifacts/geo_LHC113_AoA_14/compact-profile-predictions.npz",
        "sha256": "dbd95b4544a5fd6a4b3d15699cb3d23b932486ce13ed17164810a951119b8ffb",
        "byte_size": 27759,
        "array_order": [
          "cp_q_delta",
          "velocity_speed_over_u_inf"
        ],
        "ownership": "participant",
        "content": "predictions_only"
      },
      "surface_cp": {
        "support_identity_sha256": "7ada42c1aff1d14f16d06582074d7cec31c752321e4b0d0cf9d578549ae4bd88",
        "prediction_order_sha256": "feb4989d6667bbec4d9979675367620109ee7d1d97567de83cd4076092e28ef3",
        "physical_graph_count": 206,
        "retained_branch_count": 855,
        "retained_point_count": 22920,
        "maximum_points_per_physical_graph": 128,
        "quantization_scale": 1024,
        "quantization_dtype": "int16",
        "delta_dtype": "int16",
        "prediction_array": "cp_q_delta"
      },
      "volume_velocity": {
        "support_identity_sha256": "3b79ad5e81221f6651508db983e9203f932ba10d03db19c34d99257e54c02c82",
        "prediction_order_sha256": "0d3add5158c18c2beaa973ada59bf9f2a33df29b651a1fffd5b488c6bb22a2b9",
        "station_order": [
          "B.2",
          "B.3",
          "C.1",
          "C.2",
          "C.3"
        ],
        "station_count": 5,
        "row_count": 4005,
        "valid_row_count": 3991,
        "invalid_row_count": 14,
        "prediction_dtype": "float32",
        "prediction_array": "velocity_speed_over_u_inf",
        "storage_dtype": "uint8",
        "storage_encoding": "little_endian_float32_bits_unsigned_delta_modulo_2pow32_byte_shuffle_v1",
        "stored_byte_count": 15964
      }
    },
    {
      "case_id": "geo_LHC113_AoA_22",
      "artifact": {
        "format": "numpy-npz-v1",
        "file": "artifacts/geo_LHC113_AoA_22/compact-profile-predictions.npz",
        "sha256": "d68eb480f020e08381efd712379f87496b82dfde0633021d43dafc3bc23befca",
        "byte_size": 30612,
        "array_order": [
          "cp_q_delta",
          "velocity_speed_over_u_inf"
        ],
        "ownership": "participant",
        "content": "predictions_only"
      },
      "surface_cp": {
        "support_identity_sha256": "ad4aaf8344513e0f1639cd07172398722fab1022ee70d3ecf46cd12a7b1a9124",
        "prediction_order_sha256": "0b0c998f6c75d4069241930a1dab31ebe1afba34310a8cf219da4b8097f85c35",
        "physical_graph_count": 199,
        "retained_branch_count": 857,
        "retained_point_count": 22730,
        "maximum_points_per_physical_graph": 128,
        "quantization_scale": 1024,
        "quantization_dtype": "int16",
        "delta_dtype": "int16",
        "prediction_array": "cp_q_delta"
      },
      "volume_velocity": {
        "support_identity_sha256": "3b79ad5e81221f6651508db983e9203f932ba10d03db19c34d99257e54c02c82",
        "prediction_order_sha256": "0d3add5158c18c2beaa973ada59bf9f2a33df29b651a1fffd5b488c6bb22a2b9",
        "station_order": [
          "B.2",
          "B.3",
          "C.1",
          "C.2",
          "C.3"
        ],
        "station_count": 5,
        "row_count": 4005,
        "valid_row_count": 3991,
        "invalid_row_count": 14,
        "prediction_dtype": "float32",
        "prediction_array": "velocity_speed_over_u_inf",
        "storage_dtype": "uint8",
        "storage_encoding": "little_endian_float32_bits_unsigned_delta_modulo_2pow32_byte_shuffle_v1",
        "stored_byte_count": 15964
      }
    },
    {
      "case_id": "geo_LHC114_AoA_20",
      "artifact": {
        "format": "numpy-npz-v1",
        "file": "artifacts/geo_LHC114_AoA_20/compact-profile-predictions.npz",
        "sha256": "170b6d53b2bfee30081ec00b979628aa97538530f8ecb815dad874b58d75c31f",
        "byte_size": 31178,
        "array_order": [
          "cp_q_delta",
          "velocity_speed_over_u_inf"
        ],
        "ownership": "participant",
        "content": "predictions_only"
      },
      "surface_cp": {
        "support_identity_sha256": "0f17b051f21ae406507b960febf5b691687a6ead376f19e9ec929e81782bbb7f",
        "prediction_order_sha256": "72791842aab7923acb5e583c40fcd57728a9049ea9b20cf01e7145b669d22de2",
        "physical_graph_count": 198,
        "retained_branch_count": 892,
        "retained_point_count": 22878,
        "maximum_points_per_physical_graph": 128,
        "quantization_scale": 1024,
        "quantization_dtype": "int16",
        "delta_dtype": "int16",
        "prediction_array": "cp_q_delta"
      },
      "volume_velocity": {
        "support_identity_sha256": "3b79ad5e81221f6651508db983e9203f932ba10d03db19c34d99257e54c02c82",
        "prediction_order_sha256": "0d3add5158c18c2beaa973ada59bf9f2a33df29b651a1fffd5b488c6bb22a2b9",
        "station_order": [
          "B.2",
          "B.3",
          "C.1",
          "C.2",
          "C.3"
        ],
        "station_count": 5,
        "row_count": 4005,
        "valid_row_count": 3991,
        "invalid_row_count": 14,
        "prediction_dtype": "float32",
        "prediction_array": "velocity_speed_over_u_inf",
        "storage_dtype": "uint8",
        "storage_encoding": "little_endian_float32_bits_unsigned_delta_modulo_2pow32_byte_shuffle_v1",
        "stored_byte_count": 15964
      }
    },
    {
      "case_id": "geo_LHC115_AoA_18",
      "artifact": {
        "format": "numpy-npz-v1",
        "file": "artifacts/geo_LHC115_AoA_18/compact-profile-predictions.npz",
        "sha256": "f0cb9370a208c1445b0d4ea6c8c2810b70370267afc0ef4c7e20f64b77d53a20",
        "byte_size": 28089,
        "array_order": [
          "cp_q_delta",
          "velocity_speed_over_u_inf"
        ],
        "ownership": "participant",
        "content": "predictions_only"
      },
      "surface_cp": {
        "support_identity_sha256": "d32751b9d9d8596c798fc1b62c605886da9baf8a1494406be45e852c2568510c",
        "prediction_order_sha256": "77fa0b1b973444e04d59ebbf30879f770f6f0bbfe62fad13396ca88c5ef6c997",
        "physical_graph_count": 188,
        "retained_branch_count": 813,
        "retained_point_count": 20788,
        "maximum_points_per_physical_graph": 128,
        "quantization_scale": 1024,
        "quantization_dtype": "int16",
        "delta_dtype": "int16",
        "prediction_array": "cp_q_delta"
      },
      "volume_velocity": {
        "support_identity_sha256": "3b79ad5e81221f6651508db983e9203f932ba10d03db19c34d99257e54c02c82",
        "prediction_order_sha256": "0d3add5158c18c2beaa973ada59bf9f2a33df29b651a1fffd5b488c6bb22a2b9",
        "station_order": [
          "B.2",
          "B.3",
          "C.1",
          "C.2",
          "C.3"
        ],
        "station_count": 5,
        "row_count": 4005,
        "valid_row_count": 3991,
        "invalid_row_count": 14,
        "prediction_dtype": "float32",
        "prediction_array": "velocity_speed_over_u_inf",
        "storage_dtype": "uint8",
        "storage_encoding": "little_endian_float32_bits_unsigned_delta_modulo_2pow32_byte_shuffle_v1",
        "stored_byte_count": 15964
      }
    },
    {
      "case_id": "geo_LHC116_AoA_16",
      "artifact": {
        "format": "numpy-npz-v1",
        "file": "artifacts/geo_LHC116_AoA_16/compact-profile-predictions.npz",
        "sha256": "d3c4def0336f25f24fae5136886cf163966898e7e77ab860ecb3a9ca5235e3ec",
        "byte_size": 28968,
        "array_order": [
          "cp_q_delta",
          "velocity_speed_over_u_inf"
        ],
        "ownership": "participant",
        "content": "predictions_only"
      },
      "surface_cp": {
        "support_identity_sha256": "d6ad2eda8b651f3366808e529f6a8fb936b75f5da7a0e4a08ec6ae62b7c25d01",
        "prediction_order_sha256": "b931a0b88e689b6cd088410c0b5743c1c6db07974ad2faee8bcdb3fabb33294b",
        "physical_graph_count": 192,
        "retained_branch_count": 907,
        "retained_point_count": 22693,
        "maximum_points_per_physical_graph": 128,
        "quantization_scale": 1024,
        "quantization_dtype": "int16",
        "delta_dtype": "int16",
        "prediction_array": "cp_q_delta"
      },
      "volume_velocity": {
        "support_identity_sha256": "3b79ad5e81221f6651508db983e9203f932ba10d03db19c34d99257e54c02c82",
        "prediction_order_sha256": "0d3add5158c18c2beaa973ada59bf9f2a33df29b651a1fffd5b488c6bb22a2b9",
        "station_order": [
          "B.2",
          "B.3",
          "C.1",
          "C.2",
          "C.3"
        ],
        "station_count": 5,
        "row_count": 4005,
        "valid_row_count": 3991,
        "invalid_row_count": 14,
        "prediction_dtype": "float32",
        "prediction_array": "velocity_speed_over_u_inf",
        "storage_dtype": "uint8",
        "storage_encoding": "little_endian_float32_bits_unsigned_delta_modulo_2pow32_byte_shuffle_v1",
        "stored_byte_count": 15964
      }
    },
    {
      "case_id": "geo_LHC117_AoA_14",
      "artifact": {
        "format": "numpy-npz-v1",
        "file": "artifacts/geo_LHC117_AoA_14/compact-profile-predictions.npz",
        "sha256": "0260eaa0d8a5cd41f193c3a22181d72c92924c6ccef43ecad40aacec6af1ca61",
        "byte_size": 27387,
        "array_order": [
          "cp_q_delta",
          "velocity_speed_over_u_inf"
        ],
        "ownership": "participant",
        "content": "predictions_only"
      },
      "surface_cp": {